{
  "request_id": "55555555-5555-4555-8555-555555555555",
  "correlation_id": "66666666-6666-4666-8666-666666666666",
  "requester_id": "11111111-1111-4111-8111-111111111111",
  "environment_mode": "prod",
  "requested_capability_id": "44444444-4444-4444-8444-444444444444",
  "requested_side_effect_class": "local_file_write",
  "intent": "execute_capability",
  "intent_summary": "write approved local export",
  "requested_at": "2030-01-01T00:00:00Z"
}
